id,text,idx,sec,prev_sec,prev_sent,next_sec,next_sent,label,Comments
4948,"In fact, this module plays even more roles than the pretrained language models.",8054588,Main Results,Main Results,"From the results of both SEE and DEE we can see that the designed trigger recognition module plays a very important role to the performance, and it improves nearly 1.5% point for the F1 score of SEE, and more than 2.1% point for the F1 score of DEE.",Main Results,"Based on these results we can conclude that the triggers do contain some important cues for both kinds of EE subtasks, and making full of these cues are much helpful for improving the performance. ",POS,
4949,"Based on these results we can conclude that the triggers do contain some important cues for both kinds of EE subtasks, and making full of these cues are much helpful for improving the performance. ",8054589,Main Results,Main Results,"In fact, this module plays even more roles than the pretrained language models.",Main Results,From the results of DEE we can see that the bipartite matching loss also plays a helpful role to improve the performance.,POS,
4950,From the results of DEE we can see that the bipartite matching loss also plays a helpful role to improve the performance.,8054590,Main Results,Main Results,"Based on these results we can conclude that the triggers do contain some important cues for both kinds of EE subtasks, and making full of these cues are much helpful for improving the performance. ",Main Results,And it brings more performance gain than the adversarial training. ,POS,
4951,And it brings more performance gain than the adversarial training. ,8054591,Main Results,Main Results,From the results of DEE we can see that the bipartite matching loss also plays a helpful role to improve the performance.,Main Results,"Besides, we also conduct experiments on the DEE subtask to evaluate: (i) the impact of the layer number of the transformer-based decoder (the number N in Fig. 2) , and (ii) the impact of different sizes of sliding windows.",POS,
4952,"Besides, we also conduct experiments on the DEE subtask to evaluate: (i) the impact of the layer number of the transformer-based decoder (the number N in Fig. 2) , and (ii) the impact of different sizes of sliding windows.",8054592,Main Results,Main Results,And it brings more performance gain than the adversarial training. ,Main Results,"For the first one, we test different numbers in the range of 0 to 5.",NC,
4953,"For the first one, we test different numbers in the range of 0 to 5.",8054593,Main Results,Main Results,"Besides, we also conduct experiments on the DEE subtask to evaluate: (i) the impact of the layer number of the transformer-based decoder (the number N in Fig. 2) , and (ii) the impact of different sizes of sliding windows.",Main Results,"Our experiments show that when the number of decoder layer is set to 3, the model achieves the best results.",NC,
4954,"Our experiments show that when the number of decoder layer is set to 3, the model achieves the best results.",8054594,Main Results,Main Results,"For the first one, we test different numbers in the range of 0 to 5.",Main Results,"We think this is mainly because that a moderate layer number will lead to more complete integration of input information into event queries, while a larger or smaller number will make the model be overfit or underfit.",POS,
4955,"We think this is mainly because that a moderate layer number will lead to more complete integration of input information into event queries, while a larger or smaller number will make the model be overfit or underfit.",8054595,Main Results,Main Results,"Our experiments show that when the number of decoder layer is set to 3, the model achieves the best results.",Main Results,"For the second one, we set the size of sliding windows to 128, 256, and 512.",POS,
4956,"For the second one, we set the size of sliding windows to 128, 256, and 512.",8054596,Main Results,Main Results,"We think this is mainly because that a moderate layer number will lead to more complete integration of input information into event queries, while a larger or smaller number will make the model be overfit or underfit.",Main Results,"And their F1 scores are 64.8%, 66.9%, and 69.2% respectively when the number of the decoder's layer is set to 3 and the bipartite matching loss is used.",NC,
4957,"And their F1 scores are 64.8%, 66.9%, and 69.2% respectively when the number of the decoder's layer is set to 3 and the bipartite matching loss is used.",8054597,Main Results,Main Results,"For the second one, we set the size of sliding windows to 128, 256, and 512.",Main Results,"These results show that usually, the performance would increase as the size of the sliding window increases.",POS,
4958,"These results show that usually, the performance would increase as the size of the sliding window increases.",8054598,Main Results,Main Results,"And their F1 scores are 64.8%, 66.9%, and 69.2% respectively when the number of the decoder's layer is set to 3 and the bipartite matching loss is used.",Main Results,This is because that more context features can be taken into consideration with a larger sliding windows size.,POS,
4959,This is because that more context features can be taken into consideration with a larger sliding windows size.,8054599,Main Results,Main Results,"These results show that usually, the performance would increase as the size of the sliding window increases.",Conclusions,This paper describes our system to the LIC-2021 multi-format IE task.,POS,
4960,This paper describes our system to the LIC-2021 multi-format IE task.,8054600,Conclusions,Main Results,This is because that more context features can be taken into consideration with a larger sliding windows size.,Conclusions,"We use different methods to overcome different challenges in this competition task, including the schema disintegration method for the multiple-O-values schema issue in the RE subtask, the multi-task learning method for the SEE subtask, and the Transform-alike decoder for the DEE subtask.",FACT,
4961,"We use different methods to overcome different challenges in this competition task, including the schema disintegration method for the multiple-O-values schema issue in the RE subtask, the multi-task learning method for the SEE subtask, and the Transform-alike decoder for the DEE subtask.",8054601,Conclusions,Conclusions,This paper describes our system to the LIC-2021 multi-format IE task.,Conclusions,Experimental results show that our system is effective and it ranks No.4 on the final test set leader-board of this competition.,NC,
4962,Experimental results show that our system is effective and it ranks No.4 on the final test set leader-board of this competition.,8054602,Conclusions,Conclusions,"We use different methods to overcome different challenges in this competition task, including the schema disintegration method for the multiple-O-values schema issue in the RE subtask, the multi-task learning method for the SEE subtask, and the Transform-alike decoder for the DEE subtask.",Conclusions,"Its F1 scores are 79.887% on DuIE2.0, 85.179% on DuEE1.0, and 70.828% on DuEE-fin respectively. ",POS,
4963,"Its F1 scores are 79.887% on DuIE2.0, 85.179% on DuEE1.0, and 70.828% on DuEE-fin respectively. ",8054603,Conclusions,Conclusions,Experimental results show that our system is effective and it ranks No.4 on the final test set leader-board of this competition.,Conclusions,"However, there is still plenty of room for improvement, and lots of work should be further explored.",POS,
4964,"However, there is still plenty of room for improvement, and lots of work should be further explored.",8054604,Conclusions,Conclusions,"Its F1 scores are 79.887% on DuIE2.0, 85.179% on DuEE1.0, and 70.828% on DuEE-fin respectively. ",Conclusions,"First, in the RE subtask, many triples are not annotated.",NEG,
4965,"First, in the RE subtask, many triples are not annotated.",8054605,Conclusions,Conclusions,"However, there is still plenty of room for improvement, and lots of work should be further explored.",Conclusions,"These triples gives model wrong supervisions, which is very harmful for the performance.",NEG,
4966,"These triples gives model wrong supervisions, which is very harmful for the performance.",8054606,Conclusions,Conclusions,"First, in the RE subtask, many triples are not annotated.",Conclusions,"But this missing annotation issue is still an open issue, and should be further explored.",NEG,
4967,"But this missing annotation issue is still an open issue, and should be further explored.",8054607,Conclusions,Conclusions,"These triples gives model wrong supervisions, which is very harmful for the performance.",Conclusions,"Second, in the DEE subtask, how to process long text is still a challenge that is worthy being further studied.",PROSP,
4968,"Second, in the DEE subtask, how to process long text is still a challenge that is worthy being further studied.",8054608,Conclusions,Conclusions,"But this missing annotation issue is still an open issue, and should be further explored.",Conclusions,"In addition, if two arguments of one event are far away in the given text (either a sentence or a document), it would be difficult to extract them correctly.",PROSP,
4969,"In addition, if two arguments of one event are far away in the given text (either a sentence or a document), it would be difficult to extract them correctly.",8054609,Conclusions,Conclusions,"Second, in the DEE subtask, how to process long text is still a challenge that is worthy being further studied.",Conclusions,This issue also should be well studied in the future.,PROSP,
4970,This issue also should be well studied in the future.,8054610,Conclusions,Conclusions,"In addition, if two arguments of one event are far away in the given text (either a sentence or a document), it would be difficult to extract them correctly.",,,PROSP,
